{
  "schema_version": "buildtrace.nodes.v1",
  "project": {
    "name": "YakuBus (yakushimabus.com)",
    "purpose": "屋久岛公交时刻表、路线图、运价与上岛交通静态查询站",
    "updated_at": "2026-06-30",
    "backfill": {
      "package": "buildtrace-v1.5",
      "migration": {
        "date": "2026-07-01",
        "from": "docs/buildtrace/backups/nodes-before-v1.5.json",
        "nodes_migrated": 37,
        "nodes_removed": 1,
        "nodes_added": 2
      },
      "quick_backfill": {
        "date": "2026-07-01",
        "depth": "quick",
        "git_range": "2026-06-30 起最近 15 commits",
        "sources": [
          "README.md",
          "docs/OPS-JOURNAL.md",
          "docs/notes/2026-06-*",
          "git log -15",
          "docs/buildtrace/evidence/",
          "backups/screenshot-pre-ui-2026-06-24/"
        ],
        "result": "无 2026-06-30 之后新产品节点需新增；历史靠迁移",
        "inaccessible": [
          "压缩后的 Cursor/Claude 侧栏对话历史",
          "GA4/GSC/Baidu 后台实时数据"
        ]
      },
      "deep_backfill": {
        "range_start": "2026-05-20",
        "range_end": "2026-06-30",
        "git_commits_inspected": 108,
        "sources": [
          "git log 2026-05-20..2026-06-30 (108 commits)",
          "docs/OPS-JOURNAL.md",
          "docs/notes/ (62×2026-05 + 72×2026-06, 不含 backups/)",
          "README.md",
          "docs/seo/ (RUNBOOK, SEO-JOURNAL, metrics/)",
          "docs/product-intro.md",
          "docs/buildtrace/PROJECT-PROFILE.md",
          "可见页面结构 index/fare/ferry/map/guide/trekking/without-car/intro/about",
          "backups/screenshot-pre-ui-2026-06-24/ (仅确认存在，未逐文件解析)"
        ],
        "inaccessible": [
          "压缩后的 Cursor/Claude 侧栏对话历史",
          "GA4/GSC/Baidu 后台实时数据",
          "docs/seo/images/ 无截图实体（仅 README）",
          "docs/snapshots/ 不存在",
          "docs/buildtrace/evidence/ 为空"
        ],
        "language_repair": {
          "date": "2026-06-30",
          "package": "buildtrace-v1.2",
          "nodes_repaired": 38,
          "policy": "保留 id/date/status/types/reviewDue/路径/URL/commit/命令/原话引用；人类可读字段改中文"
        }
      }
    }
  },
  "nodes": [
    {
      "id": "2026-06-30-trace-v18-upgrade",
      "date": "2026-06-30",
      "title": "Trace / BuildTrace v1.8 工具升级（保留 39 节点）",
      "plainSummary": "按 CURSOR-UPDATE-PROMPT 边界覆盖 v1.8 工具文件，保留 nodes.json、PROJECT-PROFILE 与全部历史节点；看板新增里程碑轨、资料柜与 sourceRefs/userNotes/hidden 编辑。",
      "technicalNote": "buildtrace-v1.8.zip 覆盖 viewer/SKILL/scripts/references/release/CURSOR-UPDATE-PROMPT；备份 nodes-before-v1.8.json；viewer 继续优先加载 ../nodes.json。",
      "status": "backfilled",
      "types": [
        "ops",
        "snapshot"
      ],
      "scenario": "ops-release",
      "reviewDue": "none",
      "dateConfidence": "user-confirmed",
      "humanIntent": {
        "original": "请先读取 docs/buildtrace/CURSOR-UPDATE-PROMPT.md，然后按里面的边界维护 BuildTrace。当前版本是 BuildTrace / Trace v1.8。更新工具文件可以覆盖，但不要覆盖 docs/buildtrace/nodes.json、PROJECT-PROFILE.md、evidence/、project.resources、userNotes、hidden、sourceRefs。",
        "interpretation": "将 Trace 工具链升级到 v1.8，增强看板与证据/生命周期规范，但不丢失已回填的 39 条真实项目节点与用户档案。",
        "confidence": "confirmed-by-user"
      },
      "scenarioDetail": {
        "problem": "v1.6 看板缺少 v1.8 的里程碑轨、资料柜、sourceRefs 编辑与 evidence-policy/lifecycle 参考文档。",
        "solution": "按更新边界只覆盖工具文件，备份 nodes.json，重生成 PROJECT-NODES.md，并记录本轮升级节点。",
        "successSignal": "看板本地服务加载 40 条节点；PROJECT-PROFILE 与历史节点字段未丢失。",
        "risk": "覆盖 viewer 可能回退 ../nodes.json 加载修复（已在安装后补回）。"
      },
      "changes": {
        "added": [
          "docs/buildtrace/CURSOR-UPDATE-PROMPT.md",
          "docs/buildtrace/references/evidence-policy.md",
          "docs/buildtrace/references/lifecycle.md",
          "docs/buildtrace/release/ 发布文案",
          "看板里程碑轨与 project.resources 资料柜 UI"
        ],
        "changed": [
          "Trace v1.8 viewer/SKILL/scripts/references",
          ".cursor/rules/buildtrace.mdc",
          "~/.cursor/skills/buildtrace/"
        ],
        "removed": [],
        "optimized": [
          "看板启动优先读 ../nodes.json；清空缓存并重载而非回示例"
        ]
      },
      "technical": {
        "files": [
          "docs/buildtrace/viewer/index.html",
          "docs/buildtrace/SKILL.md",
          "docs/buildtrace/scripts/nodes-json-to-md.mjs",
          "docs/buildtrace/CURSOR-UPDATE-PROMPT.md",
          ".cursor/rules/buildtrace.mdc"
        ],
        "schema": "buildtrace.nodes.v1 + v1.8 字段（sourceRefs/userNotes/hidden/resources）",
        "architecture": "JSON 主源 + Markdown 导出 + Trace 静态看板",
        "validation": "node docs/buildtrace/scripts/nodes-json-to-md.mjs docs/buildtrace/nodes.json docs/buildtrace/PROJECT-NODES.md"
      },
      "evidence": [
        {
          "kind": "file",
          "ref": "buildtrace-v1.8.zip",
          "note": "安装包（用户路径 outputs/buildtrace-v1.8.zip）"
        },
        {
          "kind": "file",
          "ref": "docs/buildtrace/backups/nodes-before-v1.8.json",
          "note": "升级前备份（39 节点）"
        },
        {
          "kind": "doc",
          "ref": "docs/buildtrace/CURSOR-UPDATE-PROMPT.md",
          "note": "更新边界与维护流程"
        },
        {
          "kind": "doc",
          "ref": "docs/OPS-JOURNAL.md V1.8.1",
          "note": "运维记录"
        }
      ],
      "externalEvents": [
        {
          "source": "manual",
          "date": "2026-06-30",
          "kind": "note",
          "title": "用户发起 v1.8 按边界升级",
          "value": "",
          "url": "",
          "note": "本轮任务对话"
        }
      ],
      "review": {
        "watch": "看板是否显示 40 节点；里程碑轨与资料柜是否正常。",
        "result": "not-needed",
        "learning": "工具升级与用户节点数据应分轨维护，升级前先备份 nodes.json。"
      }
    },
    {
      "id": "2026-07-01-trace-v15-install",
      "date": "2026-07-01",
      "title": "Trace / BuildTrace v1.5 安装与节点迁移",
      "plainSummary": "清理旧版 SHIPLOG/BuildTrace，备份 38 条节点并迁移到 v1.5 结构（场景、人话摘要、结构化证据）。",
      "technicalNote": "docs/buildtrace/ 替换为 v1.5 包；nodes.json 从 backups/nodes-before-v1.5.json 迁移。",
      "status": "pending-review",
      "types": [
        "ops",
        "snapshot"
      ],
      "scenario": "ops-release",
      "reviewDue": "2026-07-15",
      "dateConfidence": "user-confirmed",
      "humanIntent": {
        "original": "用户要求先清理旧版 SHIPLOG/BuildTrace/Trace，安装 buildtrace-v1.5.zip，备份并迁移旧 nodes.json，再跑 quick backfill。",
        "interpretation": "将项目记忆系统升级到 v1.5（Trace 看板 + 场景字段 + 外部时间线），保留已有 38 条真实节点而非重新编造历史。",
        "confidence": "confirmed-by-user"
      },
      "scenarioDetail": {
        "problem": "旧版 BuildTrace v1.2 缺少 v1.5 的场景字段、结构化证据与 Trace 看板。",
        "solution": "备份旧 nodes.json，安装 v1.5 包，迁移节点结构，quick backfill 验证近期来源。",
        "successSignal": "看板导入后显示完整节点；缺意图节点仍标注 uncertainty。",
        "risk": "迁移可能丢失 v1.2 特有 meta 字段（已写入备份）。"
      },
      "changes": {
        "added": [
          "Trace v1.5 viewer/references/scripts",
          "nodes.json v1.5 字段（plainSummary/scenario/dateConfidence/structured evidence）",
          "docs/buildtrace/backups/nodes-before-v1.5.json"
        ],
        "changed": [
          "38 条节点从 v1.2 结构迁移到 v1.5",
          ".cursor/rules/buildtrace.mdc 更新"
        ],
        "removed": [
          "BuildTrace v1.2 包文件（由 v1.5 覆盖）"
        ],
        "optimized": [
          "项目记忆与 Trace 看板对齐"
        ]
      },
      "technical": {
        "files": [
          "docs/buildtrace/nodes.json",
          "docs/buildtrace/viewer/index.html",
          "docs/buildtrace/SKILL.md",
          ".cursor/rules/buildtrace.mdc"
        ],
        "schema": "buildtrace.nodes.v1 + v1.5 扩展字段",
        "architecture": "JSON 主源 + Markdown 导出 + Trace 静态看板",
        "validation": "node docs/buildtrace/scripts/nodes-json-to-md.mjs"
      },
      "evidence": [
        {
          "kind": "file",
          "ref": "buildtrace-v1.5.zip",
          "note": "安装包"
        },
        {
          "kind": "file",
          "ref": "docs/buildtrace/backups/nodes-before-v1.5.json",
          "note": "迁移前备份（38 节点）"
        },
        {
          "kind": "doc",
          "ref": "docs/OPS-JOURNAL.md V1.7.8",
          "note": "运维记录"
        }
      ],
      "externalEvents": [
        {
          "source": "manual",
          "date": "2026-07-01",
          "kind": "note",
          "title": "用户发起 v1.5 清理安装与 quick backfill",
          "value": "",
          "url": "",
          "note": "本轮任务对话"
        }
      ],
      "review": {
        "watch": "看板导入节点数是否与 nodes.json 一致；缺意图 5 条是否仍可见。",
        "result": "pending",
        "learning": ""
      }
    },
    {
      "id": "2026-07-01-quick-backfill-scan",
      "date": "2026-07-01",
      "title": "Quick backfill 来源扫描（v1.5 安装后）",
      "plainSummary": "v1.5 安装后扫描 README、OPS-JOURNAL、notes、git log 与证据目录，确认近期无遗漏的重要节点。",
      "technicalNote": "quick backfill 仅验证近期来源，不重复 deep backfill 的 38 条历史节点。",
      "status": "backfilled",
      "types": [
        "ops",
        "snapshot"
      ],
      "scenario": "ops-release",
      "reviewDue": "none",
      "dateConfidence": "user-confirmed",
      "humanIntent": {
        "original": "用新版规则跑一轮 quick backfill。",
        "interpretation": "安装 v1.5 后需确认近期文档与 git 是否有未收录节点；已有 deep backfill 覆盖 2026-05-20～06-30，本轮以扫描验证为主。",
        "confidence": "confirmed-by-user"
      },
      "scenarioDetail": {
        "problem": "迁移后需确认没有遗漏近期重要改动。",
        "solution": "扫描 README、docs/OPS-JOURNAL、docs/notes、git log -15、docs/buildtrace/evidence/、backups/screenshot-pre-ui-2026-06-24/。",
        "successSignal": "未发现 2026-06-30 之后的新产品节点需单独建档。",
        "risk": "压缩对话历史不可读，旧意图仍可能缺失。"
      },
      "changes": {
        "added": [
          "quick backfill 来源清单写入 project.backfill"
        ],
        "changed": [],
        "removed": [],
        "optimized": [
          "避免与 deep backfill 重复造节点"
        ]
      },
      "technical": {
        "files": [
          "docs/buildtrace/nodes.json"
        ],
        "schema": "project.backfill 元数据",
        "architecture": "quick backfill 扫描报告",
        "validation": "git log --since=2026-06-30 无新产品 commit"
      },